id,date,category,evidenceLevel,priority,relevanceScore,title,titleZh,url,doi,pmid,trialId
"pmid-42374626","2026-07-02","临床试验","临床试验研究","high","7","Microbiome and metabolites impact enteric and central nervous systems in ALS.","微生物组和代谢物影响ALS中的肠道和中枢神经系统","https://pubmed.ncbi.nlm.nih.gov/42374626/","10.1080/19490976.2026.2692737","42374626",""
"pmid-42359165","2026-07-02","临床试验","临床试验研究","high","11","Therapeutic frontiers in ALS: iPSC-based drug discovery, cell therapy, and gene therapy-Advances through 2026.","ALS治疗前沿：基于iPSC的药物发现、细胞治疗与基因治疗——截至2026年的进展","https://pubmed.ncbi.nlm.nih.gov/42359165/","10.1016/j.reth.2026.101150","42359165",""
"pmid-42367369","2026-07-02","遗传","观察性临床研究","high","15","Preparing Amyotrophic Lateral Sclerosis Clinics to Provide Longitudinal Care for Individuals Carrying ALS Risk Variants.","准备肌萎缩侧索硬化症诊所，为携带ALS风险变异的个体提供长期护理","https://pubmed.ncbi.nlm.nih.gov/42367369/","10.1212/NXG.0000000000200406","42367369",""
"pmid-42361332","2026-07-02","机制","观察性临床研究","medium","0","Patient-Reported Symptom Burden in Individuals With Parkinson Disease.","帕金森病患者报告的症状负担","https://pubmed.ncbi.nlm.nih.gov/42361332/","10.1212/CPJ.0000000000200632","42361332",""
"pmid-42359357","2026-07-02","临床试验","综述/荟萃分析","high","15","Innate immune crosstalk in ALS/FTD pathogenesis.","ALS/FTD发病机制中的先天免疫串扰","https://pubmed.ncbi.nlm.nih.gov/42359357/","10.1016/j.cellin.2026.100340","42359357",""
"pmid-42251967","2026-07-02","生物标志物","观察性临床研究","high","11","PBMC DEG/miRNA biomarkers of TDP-43 pathology in ALS.","ALS中TDP-43病理的PBMC DEG/miRNA生物标志物","https://pubmed.ncbi.nlm.nih.gov/42251967/","10.1016/j.nbd.2026.107473","42251967",""
"pmid-42242586","2026-07-02","临床试验","动物/细胞实验","high","7","Early-onset neuroinflammation drives neurodegeneration caused by lysosomal PI(3,5)P 2 insufficiency.","早发性神经炎症驱动由溶酶体PI(3,5)P₂不足引起的神经退行性变","https://pubmed.ncbi.nlm.nih.gov/42242586/","10.1016/j.nbd.2026.107467","42242586",""
"pmid-42319999","2026-07-02","遗传","待人工判定","medium","5","Teaching Video NeuroImage: Beyond Cognition: Amyotrophic Lateral Sclerosis-Like Disease in PSEN1 c.1292C>A (Jalisco Founder Effect) Variant.","教学视频神经影像：超越认知——PSEN1 c.1292C>A（哈利斯科创始人效应）变异相关的肌萎缩侧索硬化样疾病","https://pubmed.ncbi.nlm.nih.gov/42319999/","10.1212/WNL.0000000000218247","42319999",""
"pmid-42247653","2026-07-02","治疗","观察性临床研究","high","4","Drivers of Rising Prevalence in Major Motor Neurodegenerative Diseases: Temporal Trends in Sweden and France (2003-2022).","主要运动神经退行性疾病患病率上升的驱动因素：瑞典和法国的时间趋势（2003-2022年）","https://pubmed.ncbi.nlm.nih.gov/42247653/","10.1212/WNL.0000000000218072","42247653",""
"pmid-42383392","2026-07-02","治疗","综述/荟萃分析","medium","5","Role of Toll-like receptors and oral-gut-brain axis in neurodegenerative and neuropsychiatric disorders.","Toll样受体与口腔-肠道-大脑轴在神经退行性和神经精神疾病中的作用","https://pubmed.ncbi.nlm.nih.gov/42383392/","10.1515/revneuro-2026-0064","42383392",""
"pmid-42386657","2026-07-01","遗传","动物/细胞实验","high","9","The SQSTM1 L341V Variant Associated With Sporadic ALS Promotes the Accumulation of Enlarged Ubiquitin-Positive SQSTM1 Bodies.","与散发性ALS相关的SQSTM1 L341V变异促进泛素阳性SQSTM1小体的增大和积累","https://pubmed.ncbi.nlm.nih.gov/42386657/","10.1111/gtc.70134","42386657",""
"pmid-42386315","2026-07-01","机制","机制研究","high","4","Motor neuron disease: Australian state makes condition notifiable disease in world first.","运动神经元病：澳大利亚某州在全球率先将其列为法定报告疾病","https://pubmed.ncbi.nlm.nih.gov/42386315/","10.1136/bmj-2026-100149","42386315",""
"pmid-42385702","2026-07-01","遗传","动物/细胞实验","high","11","Recurrent patterns of TOP1-mediated neuronal genomic damage shared by major neurodegenerative disorders.","主要神经退行性疾病共享的TOP1介导的神经元基因组损伤的复发模式","https://pubmed.ncbi.nlm.nih.gov/42385702/","10.1016/j.cell.2026.06.013","42385702",""
"pmid-42385017","2026-07-01","机制","观察性临床研究","medium","7","Understanding patients' experiences and needs around decision-making for bulbar symptom management at a multidisciplinary ALS clinic.","理解患者在多学科ALS诊所中关于延髓症状管理的决策体验与需求","https://pubmed.ncbi.nlm.nih.gov/42385017/","10.1080/09638288.2026.2693395","42385017",""
"pmid-42384233","2026-07-01","临床试验","观察性临床研究","high","11","Genome-wide spectrum of coding DNA variations in Indian patients with amyotrophic lateral sclerosis.","印度肌萎缩侧索硬化症患者编码DNA变异的全基因组谱","https://pubmed.ncbi.nlm.nih.gov/42384233/","10.1007/s00415-026-13819-9","42384233",""
"epmc-MED-42363684","2026-07-01","机制","机制研究","medium","2","FMRP-Mediated Proteasome Regulation: A Novel Mechanism in ALS Pathology.","FMRP介导的蛋白酶体调控：ALS病理中的新机制","https://doi.org/10.1096/fj.202600563r","10.1096/fj.202600563r","42363684",""
"epmc-MED-42337937","2026-07-01","治疗","动物/细胞实验","medium","0","Engineering Extracellular Vesicles for Anti-Aging Therapy: Mechanisms, Applications, and Perspectives.","工程化细胞外囊泡用于抗衰老治疗：机制、应用与展望","https://doi.org/10.1111/acel.70607","10.1111/acel.70607","42337937",""
"epmc-MED-42281183","2026-07-01","机制","机制研究","medium","0","Disrupted Vestibular Nuclei Neuron Development in a Chick Model for Congenital Vestibular Disorders.","先天性前庭障碍鸡模型中前庭核神经元发育的紊乱","https://doi.org/10.1002/dneu.70045","10.1002/dneu.70045","42281183",""
"epmc-MED-42267670","2026-07-01","机制","机制研究","medium","0","Muscle fibre denervation in ageing.","衰老过程中的肌纤维去神经支配","https://doi.org/10.1042/cs20260761","10.1042/cs20260761","42267670",""
"epmc-PMC-PMC13295155","2026-06-27","临床试验","观察性临床研究","medium","0","Longitudinal motor function and biomarker correlates in treated adult spinal muscular atrophy: a single-center cohort study","治疗中的成人脊髓性肌萎缩症的纵向运动功能与生物标志物相关性：一项单中心队列研究","https://europepmc.org/article/PMC/PMC13295155","","",""
"epmc-PMC-PMC13293783","2026-06-27","机制","机制研究","low","0","Virtual reality training for gait disorders in Parkinson’s disease: a bibliometric and visual analysis of hotspots and trends using CiteSpace and VOSviewer","待复核翻译：Virtual reality training for gait disorders in Parkinson’s disease: a bibliometric and visual analysis of hotspots and trends using CiteSpace and VOSviewer","https://europepmc.org/article/PMC/PMC13293783","","",""
"epmc-PMC-PMC13293938","2026-06-27","临床试验","待人工判定","medium","4","Assessing upper motor neuron dysfunction in ALS: from TMS-EEG and EMG neurophysiology to a combined tFUS-TMS translational framework","待复核翻译：Assessing upper motor neuron dysfunction in ALS: from TMS-EEG and EMG neurophysiology to a combined tFUS-TMS translational framework","https://europepmc.org/article/PMC/PMC13293938","","",""
"epmc-PMC-PMC13294195","2026-06-27","治疗","待人工判定","medium","0","Editorial: Neuromuscular disorders: biomarkers, precision diagnosis, and targeted therapeutics","Editorial: Neuromuscular disorders: 生物标志物s, precision diagnosis, and targeted therapeutics","https://europepmc.org/article/PMC/PMC13294195","","",""
"epmc-PMC-PMC13294539","2026-06-27","机制","综述/荟萃分析","low","0","Acetylcholine receptor antibody-positive myasthenia gravis and Kennedy’s disease overlap syndrome: a case report and literature review","待复核翻译：Acetylcholine receptor antibody-positive myasthenia gravis and Kennedy’s disease overlap syndrome: a case report and literature review","https://europepmc.org/article/PMC/PMC13294539","","",""
"epmc-PMC-PMC13294100","2026-06-26","治疗","待人工判定","medium","0","The dual role of ATF4 in neurons: from stress adaptation to therapeutic intervention","待复核翻译：The dual role of ATF4 in neurons: from stress adaptation to therapeutic intervention","https://europepmc.org/article/PMC/PMC13294100","","",""
"epmc-PMC-PMC13291945","2026-06-26","机制","机制研究","low","0","AI-Assisted Coherent Raman Scattering Microscopy for Clinical Translation","待复核翻译：AI-Assisted Coherent Raman Scattering Microscopy for Clinical Translation","https://europepmc.org/article/PMC/PMC13291945","","",""
"epmc-PMC-PMC13293329","2026-06-26","机制","机制研究","low","0","Oxidative stress and molecular chaperones: a dynamic crosstalk in neurodegenerative disorders","待复核翻译：Oxidative stress and molecular chaperones: a dynamic crosstalk in neurodegenerative disorders","https://europepmc.org/article/PMC/PMC13293329","","",""
"epmc-PMC-PMC13290968","2026-06-26","治疗","待人工判定","medium","0","Global research trends and hotspots of exosome-mediated drug delivery across the blood-brain barrier: a bibliometric study from 2015 to 2025","待复核翻译：Global research trends and hotspots of exosome-mediated drug delivery across the blood-brain barrier: a bibliometric study from 2015 to 2025","https://europepmc.org/article/PMC/PMC13290968","","",""
"epmc-PMC-PMC13290518","2026-06-26","治疗","综述/荟萃分析","medium","0","Mesenchymal stromal/stem cells for neurological disorders in humans: an evidence-mapped clinical review","Mesenchymal stromal/干细胞s for neurological disorders in humans: an evidence-mapped clinical review","https://europepmc.org/article/PMC/PMC13290518","","",""
"epmc-PPR-PPR1260750","2026-06-26","生物标志物","待人工判定","medium","7","Real-World Serum Neurofilament Light Chain and GFAP in Amyotrophic Lateral Sclerosis on a Commercial ECLIA Platform","Real-World Serum 神经丝轻链 and GFAP in 肌萎缩侧索硬化症 on a Commercial ECLIA Platform","https://doi.org/10.64898/2026.06.24.26356370","10.64898/2026.06.24.26356370","",""
"trial-NCT05819931","2026-05-12","临床试验","临床试验注册","high","9","Breathing With Amyotrophic Lateral Sclerosis","Breathing With 肌萎缩侧索硬化症","https://clinicaltrials.gov/study/NCT05819931","","","NCT05819931"
"trial-NCT07414212","2026-02-17","临床试验","临床试验注册","high","11","Evaluation of the Combined Therapy of EH-301 and N-acetylcysteine Together With Riluzole in Amyotrophic Lateral Sclerosis (ALS)","Evaluation of the Combined Therapy of EH-301 and N-acetylcysteine Together With Riluzole in 肌萎缩侧索硬化症 (ALS)","https://clinicaltrials.gov/study/NCT07414212","","","NCT07414212"
"trial-NCT06649955","2026-01-20","临床试验","临床试验注册","high","11","Controlling Amyotrophic Lateral Sclerosis Motor Neuron Excitability Study","Controlling 肌萎缩侧索硬化症 Motor Neuron Excitability Study","https://clinicaltrials.gov/study/NCT06649955","","","NCT06649955"
"trial-NCT07143656","2025-08-28","临床试验","临床试验注册","high","11","Amyotrophic Lateral Sclerosis: A Multicenter Retrospective Observational Registry","肌萎缩侧索硬化症: A Multicenter Retrospective Observational Registry","https://clinicaltrials.gov/study/NCT07143656","","","NCT07143656"
"trial-NCT06782958","2025-01-20","临床试验","临床试验注册","high","11","Safety, Tolerability, and Pharmacokinetics of FHND1002 Granules in Healthy Adults","待复核翻译：Safety, Tolerability, and Pharmacokinetics of FHND1002 Granules in Healthy Adults","https://clinicaltrials.gov/study/NCT06782958","","","NCT06782958"
"trial-NCT05830214","2024-02-08","临床试验","临床试验注册","high","11","Digital Smartwatch Measurements as Potential Biomarkers for Remote Disease Tracking in ALS","Digital Smartwatch Measurements as Potential 生物标志物s for Remote Disease Tracking in ALS","https://clinicaltrials.gov/study/NCT05830214","","","NCT05830214"
"trial-NCT03883581","2023-03-08","临床试验","临床试验注册","high","11","Impact of Nuedexta on Bulbar Physiology and Function in ALS","待复核翻译：Impact of Nuedexta on Bulbar Physiology and Function in ALS","https://clinicaltrials.gov/study/NCT03883581","","","NCT03883581"
"trial-NCT03613038","2022-05-17","临床试验","临床试验注册","high","9","A Systematic Investigation of Phonetic Complexity Effects on Articulatory Motor Performance in Progressive Dysarthria","待复核翻译：A Systematic Investigation of Phonetic Complexity Effects on Articulatory Motor Performance in Progressive Dysarthria","https://clinicaltrials.gov/study/NCT03613038","","","NCT03613038"
"trial-NCT05019014","2021-08-24","临床试验","临床试验注册","high","9","Olfactory Deficits in Neurologic Disease","待复核翻译：Olfactory Deficits in Neurologic Disease","https://clinicaltrials.gov/study/NCT05019014","","","NCT05019014"
"trial-NCT02492516","2017-04-28","临床试验","临床试验注册","high","11","Intravenous Injection of Adipose Derived Mesenchymal Stem Cell for ALS","Intravenous Injection of Adipose Derived Mesenchymal 干细胞 for ALS","https://clinicaltrials.gov/study/NCT02492516","","","NCT02492516"
"trial-NCT02116634","2016-01-14","临床试验","临床试验注册","high","9","Mesenchymal Stem Cell Injection in Amyotrophic Lateral Sclerosis","Mesenchymal 干细胞 Injection in 肌萎缩侧索硬化症","https://clinicaltrials.gov/study/NCT02116634","","","NCT02116634"
"trial-NCT01959373","2015-08-24","临床试验","临床试验注册","high","9","Dysfunctions and Plasticity Mechanisms of Motor System Assessed by Cortico-cortical and Cortico-muscular Coherence Analysis in Amyotrophic Lateral Sclerosis","Dysfunctions and Plasticity Mechanisms of Motor System Assessed by Cortico-cortical and Cortico-muscular Coherence Analysis in 肌萎缩侧索硬化症","https://clinicaltrials.gov/study/NCT01959373","","","NCT01959373"
"trial-NCT00877604","2014-11-26","临床试验","临床试验注册","high","9","Efficacy and Tolerability of Tauroursodeoxycholic Acid in Amyotrophic Lateral Sclerosis","Efficacy and Tolerability of Tauroursodeoxycholic Acid in 肌萎缩侧索硬化症","https://clinicaltrials.gov/study/NCT00877604","","","NCT00877604"
"trial-NCT01511029","2014-11-25","临床试验","临床试验注册","high","9","Study to Evaluate the QTC Interval in Healthy Volunteers Dosed With Dexpramipexole (QTC = Electrocardiogram (ECG) Interval Measured From the Onset of the QRS Complex to the End of the T Wave Corrected for Heart Rate)","待复核翻译：Study to Evaluate the QTC Interval in Healthy Volunteers Dosed With Dexpramipexole (QTC = Electrocardiogram (ECG) Interval Measured From the Onset of the QRS Complex to the End of the T Wave Corrected for Heart Rate)","https://clinicaltrials.gov/study/NCT01511029","","","NCT01511029"
"trial-NCT00753571","2009-12-30","临床试验","临床试验注册","high","9","Cistanche Total Glycosides for Amyotrophic Lateral Sclerosis: A Randomized Control Trial (RCT) Study Assessing Clinical Response","Cistanche Total Glycosides for 肌萎缩侧索硬化症: A 随机 Control Trial (RCT) Study Assessing Clinical Response","https://clinicaltrials.gov/study/NCT00753571","","","NCT00753571"