id,date,category,evidenceLevel,priority,relevanceScore,title,titleZh,url,doi,pmid,trialId
"pmid-42374626","2026-07-11","临床试验","临床试验研究","high","7","Microbiome and metabolites impact enteric and central nervous systems in ALS.","微生物组和代谢物影响ALS中的肠道和中枢神经系统","https://pubmed.ncbi.nlm.nih.gov/42374626/","10.1080/19490976.2026.2692737","42374626",""
"pmid-42359165","2026-07-11","临床试验","临床试验研究","high","11","Therapeutic frontiers in ALS: iPSC-based drug discovery, cell therapy, and gene therapy-Advances through 2026.","ALS治疗前沿：基于iPSC的药物发现、细胞治疗与基因治疗——截至2026年的进展","https://pubmed.ncbi.nlm.nih.gov/42359165/","10.1016/j.reth.2026.101150","42359165",""
"pmid-42405014","2026-07-11","治疗","观察性临床研究","high","7","Cholesterol in amyotrophic lateral sclerosis: a bystander, a biomarker, or a target?","肌萎缩侧索硬化中的胆固醇：旁观者、生物标志物还是治疗靶点？","https://pubmed.ncbi.nlm.nih.gov/42405014/","10.1016/j.athplu.2026.100576","42405014",""
"pmid-42395866","2026-07-11","临床试验","综述/荟萃分析","high","5","The role of SUMOylation in regulating proteins that drive neuronal disease progression.","SUMO化修饰在调控驱动神经元疾病进展的蛋白质中的作用","https://pubmed.ncbi.nlm.nih.gov/42395866/","10.1016/j.bbrep.2026.102687","42395866",""
"pmid-42392979","2026-07-11","临床试验","动物/细胞实验","medium","7","Deletion of exon 2 in ALS-linked Sptlc1 causes lethality in homozygous mice but not in heterozygotes.","ALS相关Sptlc1基因外显子2缺失导致纯合子小鼠致死，但杂合子小鼠存活","https://pubmed.ncbi.nlm.nih.gov/42392979/","10.26508/lsa.202503605","42392979",""
"pmid-42276279","2026-07-11","临床试验","综述","medium","7","Naringenin as a multi-target neuroprotective agent in neurodegenerative diseases.","柚皮素作为神经退行性疾病中的多靶点神经保护剂","https://pubmed.ncbi.nlm.nih.gov/42276279/","10.1016/j.neuint.2026.106203","42276279",""
"pmid-42430680","2026-07-11","机制","观察性临床研究","medium","7","Neurology ® Journal Club: Duration of Current Statin Use and Amyotrophic Lateral Sclerosis Risk.","神经病学杂志俱乐部：当前他汀类药物使用持续时间与肌萎缩侧索硬化风险","https://pubmed.ncbi.nlm.nih.gov/42430680/","10.1212/WNL.0000000000218358","42430680",""
"pmid-42367369","2026-07-11","遗传","观察性临床研究","high","15","Preparing Amyotrophic Lateral Sclerosis Clinics to Provide Longitudinal Care for Individuals Carrying ALS Risk Variants.","准备肌萎缩侧索硬化症诊所，为携带ALS风险变异个体提供长期照护","https://pubmed.ncbi.nlm.nih.gov/42367369/","10.1212/NXG.0000000000200406","42367369",""
"pmid-42364760","2026-07-11","临床试验","待人工判定","medium","9","The impedance mismatch theory: A non-equilibrium thermodynamic framework for a shared energetic stress pathway in neurodegeneration.","阻抗失配理论：神经退行性疾病中共享能量应激通路的非平衡热力学框架","https://pubmed.ncbi.nlm.nih.gov/42364760/","10.1016/j.biosystems.2026.105862","42364760",""
"pmid-42361332","2026-07-11","机制","观察性临床研究","medium","0","Patient-Reported Symptom Burden in Individuals With Parkinson Disease.","帕金森病患者报告的症状负担","https://pubmed.ncbi.nlm.nih.gov/42361332/","10.1212/CPJ.0000000000200632","42361332",""
"pmid-42304808","2026-07-11","临床试验","待人工判定","high","11","Amyotrophic Lateral Sclerosis Recovery: A New Model System of Care Integrating Neuromuscular Rehabilitation With Clinical Stabilization in ALS.","肌萎缩侧索硬化症恢复：一种整合神经肌肉康复与临床稳定的ALS新型护理模式系统","https://pubmed.ncbi.nlm.nih.gov/42304808/","10.1002/mus.70320","42304808",""
"pmid-42407013","2026-07-11","机制","观察性临床研究","high","7","Role of the Upper Motor Neuron in the Generation of Fasciculations in Early Disease Stages of Amyotrophic Lateral Sclerosis.","上运动神经元在肌萎缩侧索硬化早期阶段肌束震颤产生中的作用","https://pubmed.ncbi.nlm.nih.gov/42407013/","10.1212/WNL.0000000000218273","42407013",""
"pmid-42319999","2026-07-11","遗传","待人工判定","medium","5","Teaching Video NeuroImage: Beyond Cognition: Amyotrophic Lateral Sclerosis-Like Disease in PSEN1 c.1292C>A (Jalisco Founder Effect) Variant.","教学视频神经影像：超越认知——PSEN1 c.1292C>A（哈利斯科创始人效应）变异相关的肌萎缩侧索硬化样疾病","https://pubmed.ncbi.nlm.nih.gov/42319999/","10.1212/WNL.0000000000218247","42319999",""
"pmid-42430317","2026-07-10","临床试验","观察性临床研究","medium","7","Preliminary Investigation of Myoelectric Control of an Assistive Neck Exoskeleton by Individuals with Amyotrophic Lateral Sclerosis.","肌萎缩侧索硬化症患者对辅助颈部外骨骼肌电控制的初步研究","https://pubmed.ncbi.nlm.nih.gov/42430317/","10.1109/TNSRE.2026.3712219","42430317",""
"pmid-42430091","2026-07-10","临床试验","综述/荟萃分析","high","5","The Role of PGC-1α in Neurodegenerative Diseases: Molecular Mechanisms, Translational Challenges, and Therapeutic Potential.","PGC-1α在神经退行性疾病中的作用：分子机制、转化挑战与治疗潜力","https://pubmed.ncbi.nlm.nih.gov/42430091/","10.1007/s12035-026-06029-x","42430091",""
"epmc-PPR-PPR1276872","2026-07-10","生物标志物","观察性临床研究","high","2","Multi-hit genetic lesions and a stress-imprinted immune transcriptome define the inflammatory pathology in ALS patients","多重打击遗传损伤与应激印记免疫转录组定义ALS患者的炎症病理","https://doi.org/10.21203/rs.3.rs-10046801/v1","10.21203/rs.3.rs-10046801/v1","",""
"epmc-MED-42429860","2026-07-10","遗传","待人工判定","high","4","Human iPSC-Derived Spinal Neurons Carrying the ALS FUS (P525L) Mutation Exhibit Lower Response to Inhibitory Neurotransmitters.","携带ALS FUS(P525L)突变的人iPSC来源脊髓神经元对抑制性神经递质的反应降低","https://doi.org/10.1007/s10571-026-01773-z","10.1007/s10571-026-01773-z","42429860",""
"epmc-MED-42429266","2026-07-10","机制","机制研究","medium","5","Gait speed and future ambulatory status in amyotrophic lateral sclerosis: a retrospective observational study with implications for power wheelchair referral.","肌萎缩侧索硬化症中的步速与未来行走状态：一项对电动轮椅转诊有启示的回顾性观察研究","https://doi.org/10.1080/09593985.2026.2700400","10.1080/09593985.2026.2700400","42429266",""
"epmc-MED-42427030","2026-07-09","临床试验","待人工判定","high","2","C9orf72-associated poly-GR in skeletal muscle leads to neuromuscular junction deficits and muscle atrophy.","C9orf72相关多聚GR蛋白在骨骼肌中导致神经肌肉接头缺陷和肌肉萎缩","https://doi.org/10.1016/j.ymthe.2026.07.002","10.1016/j.ymthe.2026.07.002","42427030",""
"epmc-MED-42425598","2026-07-09","机制","机制研究","medium","5","Unusual presentation of amyotrophic lateral sclerosis years after a motor-vehicle collision.","运动车辆碰撞多年后肌萎缩侧索硬化症的不寻常表现","https://doi.org/10.1136/bcr-2026-272139","10.1136/bcr-2026-272139","42425598",""
"epmc-MED-42425169","2026-07-09","生物标志物","观察性临床研究","medium","7","Sex-associated neuroinflammatory and astrocytic responses in amyotrophic lateral sclerosis: evidence from clinical cohorts and a TDP-43 N390D mouse model.","Sex-associated neuroinflammatory and astrocytic responses in 肌萎缩侧索硬化症: evidence from clinical cohorts and a TDP-43 N390D mouse model.","https://doi.org/10.1016/j.bbi.2026.106884","10.1016/j.bbi.2026.106884","42425169",""
"epmc-MED-42425084","2026-07-09","机制","机制研究","low","0","RNA-dependent SFPQ condensates coordinate multidimensional regulation of extra-long neuronal genes.","待复核翻译：RNA-dependent SFPQ condensates coordinate multidimensional regulation of extra-long neuronal genes.","https://doi.org/10.1016/j.chembiol.2026.06.004","10.1016/j.chembiol.2026.06.004","42425084",""
"epmc-MED-42424231","2026-07-09","生物标志物","待人工判定","medium","2","Neurofilament Light Chain as a Biomarker in Neurology.","神经丝轻链 as a 生物标志物 in Neurology.","https://doi.org/10.1159/000552933","10.1159/000552933","42424231",""
"epmc-PPR-PPR1276355","2026-07-09","机制","机制研究","low","5","Does OMOP CDM Conversion Improve Cross-Country Comparability of Real-World Data? A Benchmark Study in Breast Cancer and Amyotrophic Lateral Sclerosis","Does OMOP CDM Conversion Improve Cross-Country Comparability of Real-World Data? A Benchmark Study in Breast Cancer and 肌萎缩侧索硬化症","https://doi.org/10.64898/2026.07.06.26357353","10.64898/2026.07.06.26357353","",""
"epmc-MED-42423631","2026-07-09","机制","观察性临床研究","low","5","Identifying Gastrostomy Care and Home Gastrostomy Tube Feeding-Related Educational Content for Patients With Amyotrophic Lateral Sclerosis and Their Family Caregivers: A Delphi Panel With Professional Stakeholders.","Identifying Gastrostomy Care and Home Gastrostomy Tube Feeding-Related Educational Content for Patients With 肌萎缩侧索硬化症 and Their Family Caregivers: A Delphi Panel With Professional Stakeholders.","https://doi.org/10.1097/sga.0000000000000937","10.1097/sga.0000000000000937","42423631",""
"epmc-MED-42428795","2026-07-08","机制","机制研究","low","2","Dysregulated neuronal mRNA transport and translation in FTD/ALS.","待复核翻译：Dysregulated neuronal mRNA transport and translation in FTD/ALS.","https://doi.org/10.1038/s44400-026-00116-5","10.1038/s44400-026-00116-5","42428795",""
"epmc-PPR-PPR1273894","2026-07-08","遗传","待人工判定","medium","2","Multi-omics of C9orf72 spinal cord organoids reveal convergent molecular signatures and targets","待复核翻译：Multi-omics of C9orf72 spinal cord organoids reveal convergent molecular signatures and targets","https://doi.org/10.21203/rs.3.rs-10053820/v1","10.21203/rs.3.rs-10053820/v1","",""
"epmc-MED-42420559","2026-07-08","机制","动物/细胞实验","medium","2","Microglial TDP-43 mediates myelin refinement and represses Tyrobp cryptic exon inclusion in mice.","小胶质细胞l TDP-43 mediates myelin refinement and represses Tyrobp cryptic exon inclusion in mice.","https://doi.org/10.1038/s41593-026-02348-3","10.1038/s41593-026-02348-3","42420559",""
"epmc-MED-42419740","2026-07-08","机制","机制研究","low","0","TOP1MT rs2293925 is an enhancer-active regulatory SNP that shapes mitochondrial R-loop dynamics.","TOP1MT rs2293925 is an enhancer-active regulatory SNP that shapes 线粒体l R-loop dynamics.","https://doi.org/10.1111/febs.70649","10.1111/febs.70649","42419740",""
"trial-NCT03362658","2026-05-08","临床试验","临床试验注册","high","15","Novel MRI Biomarkers for Monitoring Disease Progression in ALS","Novel MRI 生物标志物s for Monitoring Disease Progression in ALS","https://clinicaltrials.gov/study/NCT03362658","","","NCT03362658"
"trial-NCT00415519","2026-01-06","临床试验","临床试验注册","high","11","Efficacy and Safety Study of MCI-186 for Treatment of Amyotrophic Lateral Sclerosis (ALS) Who Met Severity Classification III","Efficacy and Safety Study of MCI-186 for Treatment of 肌萎缩侧索硬化症 (ALS) Who Met Severity Classification III","https://clinicaltrials.gov/study/NCT00415519","","","NCT00415519"
"trial-NCT04866771","2025-08-07","临床试验","临床试验注册","high","11","Remotely Supervised tDCS for Slowing ALS Disease Progression","待复核翻译：Remotely Supervised tDCS for Slowing ALS Disease Progression","https://clinicaltrials.gov/study/NCT04866771","","","NCT04866771"
"trial-NCT06658977","2025-06-08","临床试验","临床试验注册","high","11","RolloverTreatment With Triumeq for People With ALS Following the Lighthouse II Trial","待复核翻译：RolloverTreatment With Triumeq for People With ALS Following the Lighthouse II Trial","https://clinicaltrials.gov/study/NCT06658977","","","NCT06658977"
"trial-NCT06700304","2025-05-31","临床试验","临床试验注册","high","11","CAN-PRIME: Precise Robotically Implanted Brain-Computer Interface for the Control of External Devices","CAN-PRIME: Precise Robotically Implanted 脑机接口 for the Control of External Devices","https://clinicaltrials.gov/study/NCT06700304","","","NCT06700304"
"trial-NCT06973629","2025-05-22","临床试验","临床试验注册","high","11","Efficacy and Safety of MSC-NTF (NurOwn) in Participants With Early Symptomatic ALS and Moderate Disease Presentation in ALS (ENDURANCE STUDY)","待复核翻译：Efficacy and Safety of MSC-NTF (NurOwn) in Participants With Early Symptomatic ALS and Moderate Disease Presentation in ALS (ENDURANCE STUDY)","https://clinicaltrials.gov/study/NCT06973629","","","NCT06973629"
"trial-NCT06528964","2024-12-16","临床试验","临床试验注册","high","9","Proteinopathies Expression in Skin of Neurodegenerative Disorders","待复核翻译：Proteinopathies Expression in Skin of Neurodegenerative Disorders","https://clinicaltrials.gov/study/NCT06528964","","","NCT06528964"
"trial-NCT04026581","2023-12-06","临床试验","临床试验注册","high","9","Real World Testing of a Brain-Computer Interface","Real World Testing of a 脑机接口","https://clinicaltrials.gov/study/NCT04026581","","","NCT04026581"
"trial-NCT05328492","2023-06-01","临床试验","临床试验注册","high","9","Volume Mode Non-invasive Ventilation in Amyotrophic Lateral Sclerosis","Volume Mode Non-invasive Ventilation in 肌萎缩侧索硬化症","https://clinicaltrials.gov/study/NCT05328492","","","NCT05328492"
"trial-NCT03088839","2023-03-15","临床试验","临床试验注册","high","11","Circulating Biomarker for Amyotrophic Lateral Sclerosis (ALS)","Circulating 生物标志物 for 肌萎缩侧索硬化症 (ALS)","https://clinicaltrials.gov/study/NCT03088839","","","NCT03088839"
"trial-NCT03868345","2023-03-09","临床试验","临床试验注册","high","11","Speech Analysis in ALS Patients","待复核翻译：Speech Analysis in ALS Patients","https://clinicaltrials.gov/study/NCT03868345","","","NCT03868345"
"trial-NCT03887338","2021-03-02","临床试验","临床试验注册","high","11","Systematic Laryngoscopic Evaluation of Upper Airways in Ventilated ALS Patients in Portugal and in Norway","待复核翻译：Systematic Laryngoscopic Evaluation of Upper Airways in Ventilated ALS Patients in Portugal and in Norway","https://clinicaltrials.gov/study/NCT03887338","","","NCT03887338"
"trial-NCT04454892","2020-07-02","临床试验","临床试验注册","high","11","Natural History and Clinical Features of Amyotrophic Lateral Sclerosis (ALS)","Natural History and Clinical Features of 肌萎缩侧索硬化症 (ALS)","https://clinicaltrials.gov/study/NCT04454892","","","NCT04454892"
"trial-NCT01016522","2015-04-01","临床试验","临床试验注册","high","11","Safety and Tolerability of the Ketogenic Diet in Amyotrophic Lateral Sclerosis (ALS)","Safety and Tolerability of the Ketogenic Diet in 肌萎缩侧索硬化症 (ALS)","https://clinicaltrials.gov/study/NCT01016522","","","NCT01016522"
"trial-NCT00331812","2011-01-19","临床试验","临床试验注册","high","11","Mitochondrial Functions and Oxidative Stress in ALS Patients","线粒体l Functions and Oxidative Stress in ALS Patients","https://clinicaltrials.gov/study/NCT00331812","","","NCT00331812"